{
  "domain": "goodhousekeeping.com",
  "vertical": null,
  "source": "live",
  "checked_at": "2026-10-30T06:21:40.912Z",
  "fetch": {
    "user_agent": "AyoGTMResearch/0.1 (+https://blankspace-publisher-call-sheet.pages.dev/method#crawler)",
    "requests": 8,
    "blocked": [],
    "skipped": []
  },
  "signals": {
    "readership": {
      "status": "not_in_sample"
    },
    "placement": {
      "sitemap_url": "https://www.goodhousekeeping.com/en/sitemaps/content.2017-11-03T22:09:02.xml.gz",
      "slugs_sampled": 50,
      "slugs_matched": 4,
      "slug_share": 0.08,
      "matched_examples": [
        "https://www.goodhousekeeping.com/what-to-buy/g4668/best-face-oils/",
        "https://www.goodhousekeeping.com/what-to-buy/childrens-products/g4695/best-kids-toys/",
        "https://www.goodhousekeeping.com/holidays/gift-ideas/g4670/best-friend-gifts/",
        "https://www.goodhousekeeping.com/what-to-buy/g4799/best-baby-carriers/"
      ],
      "schema_types": [
        "ItemList"
      ],
      "pages_checked": [
        "https://www.goodhousekeeping.com/"
      ]
    },
    "programmatic": {
      "ads_txt": {
        "present": true,
        "url": "https://www.goodhousekeeping.com/ads.txt",
        "status": 200,
        "records": 66,
        "ad_systems": 25,
        "direct": 66,
        "reseller": 0,
        "managerdomain": null,
        "ownerdomain": "hearst.com",
        "contact": [
          "adstxt@hearst.com"
        ],
        "note": null
      },
      "header_bidding": {
        "detected": [],
        "scope": "initial_html"
      },
      "ad_server_tag": {
        "gpt": false
      }
    },
    "reachability": {
      "robots_url": "https://goodhousekeeping.com/robots.txt",
      "status": 200,
      "per_agent": {
        "GPTBot": "allowed",
        "ClaudeBot": "allowed",
        "Google-Extended": "blocked",
        "CCBot": "blocked",
        "Applebot-Extended": "allowed",
        "Meta-ExternalAgent": "allowed",
        "Bytespider": "blocked",
        "OAI-SearchBot": "allowed",
        "ChatGPT-User": "allowed",
        "PerplexityBot": "blocked",
        "Perplexity-User": "allowed",
        "Claude-SearchBot": "allowed",
        "Claude-User": "allowed",
        "OAI-AdsBot": "allowed"
      },
      "training": "partial",
      "search": "partial",
      "ai_rules_present": true,
      "content_signal": [],
      "excerpt": [
        "User-agent: CCBot",
        "User-agent: Google-Extended",
        "User-agent: anthropic-ai",
        "User-agent: PerplexityBot",
        "User-agent: OmigiliBot",
        "User-agent: Amazonbot",
        "User-agent: Bytespider",
        "Disallow: /",
        "User-agent: ChatGPT-User",
        "User-agent: GPTBot",
        "User-agent: OAI-SearchBot",
        "Disallow: /au/",
        "Disallow: /cn/",
        "Disallow: /dk/",
        "Disallow: /en/",
        "Disallow: /es/",
        "Disallow: /in/",
        "Disallow: /it/",
        "Disallow: /ng/",
        "Disallow: /nl/",
        "Disallow: /no/",
        "Disallow: /se/",
        "Disallow: /ua/",
        "Disallow: /uk/",
        "User-agent: ChatGPT-User",
        "User-agent: GPTBot",
        "User-agent: OAI-SearchBot",
        "User-agent: *",
        "Disallow: /auth/",
        "Disallow: /preview/",
        "Disallow: /au/preview/",
        "Disallow: /cn/preview/",
        "Disallow: /dk/preview/",
        "Disallow: /en/preview/",
        "Disallow: /es/preview/",
        "Disallow: /in/preview/",
        "Disallow: /it/preview/",
        "Disallow: /jp/preview/",
        "Disallow: /ng/preview/",
        "Disallow: /nl/preview/"
      ]
    },
    "commerce": {
      "networks": [],
      "evidence": []
    },
    "cdn": {
      "providers": [
        "cloudflare"
      ],
      "evidence_headers": [
        "cf-ray",
        "server: cloudflare"
      ]
    }
  },
  "score": {
    "weights": {
      "readership": 40,
      "placement": 20,
      "programmatic": 15,
      "reachability": 10,
      "commerce": 15
    },
    "subscores": {
      "readership": null,
      "placement": 0.45,
      "programmatic": 0.667,
      "reachability": 0.5,
      "commerce": 0
    },
    "points": {
      "readership": null,
      "placement": 9,
      "programmatic": 10,
      "reachability": 5,
      "commerce": 0
    },
    "maxima": {
      "readership": 0,
      "placement": 20,
      "programmatic": 15,
      "reachability": 10,
      "commerce": 15
    },
    "total": 24,
    "max": 60,
    "missed": [
      "Placement: 4 of 50 sampled sitemap URLs look like roundups, comparisons or reviews (8%). Full marks start at 30%.",
      "Programmatic: no header bidding seen in the initial HTML. It may load later.",
      "Reachability: search and user-triggered agents are partly disallowed in robots.txt.",
      "Commerce: no affiliate network links found in the pages checked."
    ]
  },
  "stance": {
    "code": "closed-door",
    "angle_label": "Search agents are disallowed in robots.txt. The reason is not visible from outside."
  },
  "cannot_see": [
    "Real agent traffic volumes",
    "Direct-sold ad revenue",
    "Who owns AI policy internally"
  ],
  "cache": {
    "hit": false,
    "stored_at": null
  }
}