{
  "domain": "treelinereview.com",
  "vertical": null,
  "source": "live",
  "checked_at": "2026-10-30T06:23:28.554Z",
  "fetch": {
    "user_agent": "AyoGTMResearch/0.1 (+https://blankspace-publisher-call-sheet.pages.dev/method#crawler)",
    "requests": 8,
    "blocked": [],
    "skipped": []
  },
  "signals": {
    "readership": {
      "status": "not_in_sample"
    },
    "placement": {
      "sitemap_url": "https://www.treelinereview.com/sitemap.xml",
      "slugs_sampled": 48,
      "slugs_matched": 45,
      "slug_share": 0.938,
      "matched_examples": [
        "https://www.treelinereview.com/gearreviews/biolite-luci-44-solar-string-lights-review",
        "https://www.treelinereview.com/gearreviews/petzl-swift-lt-headlamp-review",
        "https://www.treelinereview.com/gearreviews/best-dog-paw-balms",
        "https://www.treelinereview.com/gearreviews/la-sportiva-prodigio-hike-lt-gtx-hiking-boots-review",
        "https://www.treelinereview.com/gearreviews/patagonia-nano-puff-jacket-insulated-jacket-review"
      ],
      "schema_types": [],
      "pages_checked": [
        "https://www.treelinereview.com/",
        "https://www.treelinereview.com/gearreviews/biolite-luci-44-solar-string-lights-review"
      ]
    },
    "programmatic": {
      "ads_txt": {
        "present": false,
        "url": "https://www.treelinereview.com/ads.txt",
        "status": 404,
        "note": null
      },
      "header_bidding": {
        "detected": [],
        "scope": "initial_html"
      },
      "ad_server_tag": {
        "gpt": false
      }
    },
    "reachability": {
      "robots_url": "https://treelinereview.com/robots.txt",
      "status": 200,
      "per_agent": {
        "GPTBot": "allowed",
        "ClaudeBot": "allowed",
        "Google-Extended": "allowed",
        "CCBot": "allowed",
        "Applebot-Extended": "allowed",
        "Meta-ExternalAgent": "allowed",
        "Bytespider": "allowed",
        "OAI-SearchBot": "allowed",
        "ChatGPT-User": "allowed",
        "PerplexityBot": "allowed",
        "Perplexity-User": "allowed",
        "Claude-SearchBot": "allowed",
        "Claude-User": "allowed",
        "OAI-AdsBot": "allowed"
      },
      "training": "allowed",
      "search": "allowed",
      "ai_rules_present": true,
      "content_signal": [],
      "excerpt": [
        "User-agent: AI2Bot",
        "User-agent: Ai2Bot-Dolma",
        "User-agent: aiHitBot",
        "User-agent: Amazonbot",
        "User-agent: anthropic-ai",
        "User-agent: Applebot-Extended",
        "User-agent: Bytespider",
        "User-agent: CCBot",
        "User-agent: ClaudeBot",
        "User-agent: cohere-ai",
        "User-agent: cohere-training-data-crawler",
        "User-agent: DuckAssistBot",
        "User-agent: FacebookBot",
        "User-agent: Google-Extended",
        "User-agent: GoogleOther",
        "User-agent: GoogleOther-Image",
        "User-agent: GoogleOther-Video",
        "User-agent: GPTBot",
        "User-agent: img2dataset",
        "User-agent: Meta-ExternalAgent",
        "User-agent: MyCentralAIScraperBot",
        "User-agent: omgili",
        "User-agent: omgilibot",
        "User-agent: Quora-Bot",
        "User-agent: TikTokSpider",
        "User-agent: YouBot",
        "User-agent: AdsBot-Google",
        "User-agent: AdsBot-Google-Mobile",
        "User-agent: AdsBot-Google-Mobile-Apps",
        "User-agent: *",
        "Disallow: /config",
        "Disallow: /search",
        "Disallow: /account$",
        "Disallow: /account/",
        "Disallow: /commerce/digital-download/",
        "Disallow: /api/",
        "Allow: /api/ui-extensions/",
        "Disallow: /static/",
        "Disallow:/*?author=*",
        "Disallow:/*&author=*"
      ]
    },
    "commerce": {
      "networks": [
        "amazon"
      ],
      "evidence": [
        {
          "network": "amazon",
          "pattern": "amazon.* with tag=",
          "page": "https://www.treelinereview.com/gearreviews/biolite-luci-44-solar-string-lights-review"
        }
      ]
    },
    "cdn": {
      "providers": [
        "cloudflare"
      ],
      "evidence_headers": [
        "cf-ray",
        "server: cloudflare"
      ]
    }
  },
  "score": {
    "weights": {
      "readership": 40,
      "placement": 20,
      "programmatic": 15,
      "reachability": 10,
      "commerce": 15
    },
    "subscores": {
      "readership": null,
      "placement": 0.75,
      "programmatic": 0,
      "reachability": 1,
      "commerce": 0.667
    },
    "points": {
      "readership": null,
      "placement": 15,
      "programmatic": 0,
      "reachability": 10,
      "commerce": 10
    },
    "maxima": {
      "readership": 0,
      "placement": 20,
      "programmatic": 15,
      "reachability": 10,
      "commerce": 15
    },
    "total": 35,
    "max": 60,
    "missed": [
      "Placement: no ItemList, Product or Review markup on the 2 pages checked.",
      "Programmatic: no ads.txt found.",
      "Programmatic: no header bidding seen in the initial HTML. It may load later.",
      "Commerce: one affiliate network found. Full marks need two."
    ]
  },
  "stance": {
    "code": "reading-free",
    "angle_label": "AI agents read you every day, free."
  },
  "cannot_see": [
    "Real agent traffic volumes",
    "Direct-sold ad revenue",
    "Who owns AI policy internally"
  ],
  "cache": {
    "hit": false,
    "stored_at": null
  }
}